{
  "schema_version": 1,
  "task_id": "bottlenecks-multi-manifold-2026-09-23",
  "status": "done",
  "updated_utc": "2026-09-23T14:22:15Z",
  "plan": "PLAN.md",
  "human_state": "agent-notes/STATE.md",
  "current_step": "P4",
  "next_action": "None; task complete.",
  "relevant_notes": [
    "agent-notes/ADP/index-pipeline.md",
    "agent-notes/ADP/multi-index.md",
    "agent-notes/ADP/manifold.md",
    "agent-notes/ADP/solvers.md"
  ],
  "relevant_sources": [
    "SRC-IFIT-LOOP",
    "SRC-MAN-FIT-ORCH"
  ],
  "evidence": [
    "PLAN.md",
    "benchmarks/fit_bottlenecks.py",
    "docs/experiments/bottlenecks_2026-09-23/multi_base_baseline.json",
    "docs/experiments/bottlenecks_2026-09-23/manifold_base_baseline.json",
    "docs/experiments/bottlenecks_2026-09-23/multi_base_time.json",
    "docs/experiments/bottlenecks_2026-09-23/multi_base_time_converged.json",
    "docs/experiments/bottlenecks_2026-09-23/multi_J2_time_converged.json",
    "docs/experiments/bottlenecks_2026-09-23/manifold_base_time.json",
    "docs/experiments/bottlenecks_2026-09-23/manifold_J2_time.json",
    "docs/adp_fit_bottlenecks.md"
  ],
  "blockers": [],
  "head": "c58c5cf4eb269ea3c7476e775342c771c9419158",
  "dirty": true
}
